{
  "schemaVersion": 1,
  "corpus": "python-profile-fact-mutations-v1",
  "clock": "2026-09-05T00:00:00Z",
  "cases": [
    {"scenario":"profile-merge","args":["profile-patch","--input","-","--expected-revision","1","--source","user"],"input":{"identity":{"name":"Synthetic Person","city":"Example"}},"exitCode":0,"stdout":"{\n  \"factProvenance\": {\n    \"/identity/city\": {\n      \"source\": \"user\",\n      \"updatedAt\": \"2026-09-05T00:00:00Z\"\n    },\n    \"/identity/name\": {\n      \"source\": \"user\",\n      \"updatedAt\": \"2026-09-05T00:00:00Z\"\n    }\n  },\n  \"profile\": {\n    \"identity\": {\n      \"city\": \"Example\",\n      \"name\": \"Synthetic Person\"\n    }\n  },\n  \"revision\": 2,\n  \"updatedAt\": \"2026-09-05T00:00:00Z\"\n}\n","stderr":"","uuidCalls":0,"nonceCalls":0,"expectedWrites":["profile.json"],"observedWrites":["profile.json"],"effects":[{"path":"profile.json","before":"{\n  \"metadata\": {\n    \"createdAt\": \"2026-09-05T00:00:00Z\",\n    \"factProvenance\": {},\n    \"revision\": 1,\n    \"updatedAt\": \"2026-09-05T00:00:00Z\"\n  },\n  \"profile\": {},\n  \"schemaVersion\": 1\n}\n","after":"{\n  \"metadata\": {\n    \"createdAt\": \"2026-09-05T00:00:00Z\",\n    \"factProvenance\": {\n      \"/identity/city\": {\n        \"source\": \"user\",\n        \"updatedAt\": \"2026-09-05T00:00:00Z\"\n      },\n      \"/identity/name\": {\n        \"source\": \"user\",\n        \"updatedAt\": \"2026-09-05T00:00:00Z\"\n      }\n    },\n    \"revision\": 2,\n    \"updatedAt\": \"2026-09-05T00:00:00Z\"\n  },\n  \"profile\": {\n    \"identity\": {\n      \"city\": \"Example\",\n      \"name\": \"Synthetic Person\"\n    }\n  },\n  \"schemaVersion\": 1\n}\n","mtimeChanged":true,"modeContract":"0600-on-posix-unverified-on-windows"}],"untouchedEntriesUnchanged":true,"rejectedStateUnchanged":false},
    {"scenario":"profile-nested-delete","args":["profile-patch","--input","-","--expected-revision","2","--source","user"],"input":{"identity":{"city":null}},"exitCode":0,"stdout":"{\n  \"factProvenance\": {\n    \"/identity/city\": {\n      \"source\": \"user\",\n      \"updatedAt\": \"2026-09-05T00:00:00Z\"\n    },\n    \"/identity/name\": {\n      \"source\": \"user\",\n      \"updatedAt\": \"2026-09-05T00:00:00Z\"\n    }\n  },\n  \"profile\": {\n    \"identity\": {\n      \"name\": \"Synthetic Person\"\n    }\n  },\n  \"revision\": 3,\n  \"updatedAt\": \"2026-09-05T00:00:00Z\"\n}\n","stderr":"","uuidCalls":0,"nonceCalls":0,"expectedWrites":["profile.json"],"observedWrites":["profile.json"],"effects":[{"path":"profile.json","before":"{\n  \"metadata\": {\n    \"createdAt\": \"2026-09-05T00:00:00Z\",\n    \"factProvenance\": {\n      \"/identity/city\": {\n        \"source\": \"user\",\n        \"updatedAt\": \"2026-09-05T00:00:00Z\"\n      },\n      \"/identity/name\": {\n        \"source\": \"user\",\n        \"updatedAt\": \"2026-09-05T00:00:00Z\"\n      }\n    },\n    \"revision\": 2,\n    \"updatedAt\": \"2026-09-05T00:00:00Z\"\n  },\n  \"profile\": {\n    \"identity\": {\n      \"city\": \"Example\",\n      \"name\": \"Synthetic Person\"\n    }\n  },\n  \"schemaVersion\": 1\n}\n","after":"{\n  \"metadata\": {\n    \"createdAt\": \"2026-09-05T00:00:00Z\",\n    \"factProvenance\": {\n      \"/identity/city\": {\n        \"source\": \"user\",\n        \"updatedAt\": \"2026-09-05T00:00:00Z\"\n      },\n      \"/identity/name\": {\n        \"source\": \"user\",\n        \"updatedAt\": \"2026-09-05T00:00:00Z\"\n      }\n    },\n    \"revision\": 3,\n    \"updatedAt\": \"2026-09-05T00:00:00Z\"\n  },\n  \"profile\": {\n    \"identity\": {\n      \"name\": \"Synthetic Person\"\n    }\n  },\n  \"schemaVersion\": 1\n}\n","mtimeChanged":true,"modeContract":"0600-on-posix-unverified-on-windows"}],"untouchedEntriesUnchanged":true,"rejectedStateUnchanged":false},
    {"scenario":"profile-pointer-escaping","args":["profile-patch","--input","-","--expected-revision","1","--source","user"],"input":{"a/b~c":"Synthetic"},"exitCode":0,"stdout":"{\n  \"factProvenance\": {\n    \"/a~1b~0c\": {\n      \"source\": \"user\",\n      \"updatedAt\": \"2026-09-05T00:00:00Z\"\n    }\n  },\n  \"profile\": {\n    \"a/b~c\": \"Synthetic\"\n  },\n  \"revision\": 2,\n  \"updatedAt\": \"2026-09-05T00:00:00Z\"\n}\n","stderr":"","uuidCalls":0,"nonceCalls":0,"expectedWrites":["profile.json"],"observedWrites":["profile.json"],"effects":[{"path":"profile.json","before":"{\n  \"metadata\": {\n    \"createdAt\": \"2026-09-05T00:00:00Z\",\n    \"factProvenance\": {},\n    \"revision\": 1,\n    \"updatedAt\": \"2026-09-05T00:00:00Z\"\n  },\n  \"profile\": {},\n  \"schemaVersion\": 1\n}\n","after":"{\n  \"metadata\": {\n    \"createdAt\": \"2026-09-05T00:00:00Z\",\n    \"factProvenance\": {\n      \"/a~1b~0c\": {\n        \"source\": \"user\",\n        \"updatedAt\": \"2026-09-05T00:00:00Z\"\n      }\n    },\n    \"revision\": 2,\n    \"updatedAt\": \"2026-09-05T00:00:00Z\"\n  },\n  \"profile\": {\n    \"a/b~c\": \"Synthetic\"\n  },\n  \"schemaVersion\": 1\n}\n","mtimeChanged":true,"modeContract":"0600-on-posix-unverified-on-windows"}],"untouchedEntriesUnchanged":true,"rejectedStateUnchanged":false},
    {"scenario":"profile-noop","args":["profile-patch","--input","-","--expected-revision","2","--source","user"],"input":{"identity":{"name":"Synthetic Person","city":"Example"}},"exitCode":0,"stdout":"{\n  \"factProvenance\": {\n    \"/identity/city\": {\n      \"source\": \"user\",\n      \"updatedAt\": \"2026-09-05T00:00:00Z\"\n    },\n    \"/identity/name\": {\n      \"source\": \"user\",\n      \"updatedAt\": \"2026-09-05T00:00:00Z\"\n    }\n  },\n  \"profile\": {\n    \"identity\": {\n      \"city\": \"Example\",\n      \"name\": \"Synthetic Person\"\n    }\n  },\n  \"revision\": 2,\n  \"updatedAt\": \"2026-09-05T00:00:00Z\"\n}\n","stderr":"","uuidCalls":0,"nonceCalls":0,"expectedWrites":[],"observedWrites":[],"effects":[],"untouchedEntriesUnchanged":true,"rejectedStateUnchanged":false},
    {"scenario":"profile-revision-conflict","args":["profile-patch","--input","-","--expected-revision","1","--source","user"],"input":{"identity":{"name":"<secret-canary>"}},"exitCode":2,"stdout":"","stderr":"job-apply-store: profile revision conflict\n","uuidCalls":0,"nonceCalls":0,"expectedWrites":[],"observedWrites":[],"effects":[],"untouchedEntriesUnchanged":true,"rejectedStateUnchanged":true},
    {"scenario":"profile-provenance-conflict","args":["profile-patch","--input","-","--expected-revision","2","--source","agent"],"input":{"identity":{"name":"<secret-canary>"}},"exitCode":2,"stdout":"","stderr":"job-apply-store: profile change conflicts with user-provenanced facts\n","uuidCalls":0,"nonceCalls":0,"expectedWrites":[],"observedWrites":[],"effects":[],"untouchedEntriesUnchanged":true,"rejectedStateUnchanged":true},
    {"scenario":"profile-empty-input","args":["profile-patch","--input","-","--expected-revision","1","--source","user"],"input":{},"exitCode":2,"stdout":"","stderr":"job-apply-store: profile patch must not be empty\n","uuidCalls":0,"nonceCalls":0,"expectedWrites":[],"observedWrites":[],"effects":[],"untouchedEntriesUnchanged":true,"rejectedStateUnchanged":true},
    {"scenario":"profile-nonobject-input","args":["profile-patch","--input","-","--expected-revision","1","--source","user"],"input":["<secret-canary>"],"exitCode":2,"stdout":"","stderr":"job-apply-store: input must be a JSON object\n","uuidCalls":0,"nonceCalls":0,"expectedWrites":[],"observedWrites":[],"effects":[],"untouchedEntriesUnchanged":true,"rejectedStateUnchanged":true},
    {"scenario":"group-create","args":["fact-group-create","--input","-"],"input":{"label":" Identity ","paths":["/identity/name","/identity/city"]},"exitCode":0,"stdout":"{\n  \"createdAt\": \"2026-09-05T00:00:00Z\",\n  \"id\": \"00000000000000000000000000000001\",\n  \"label\": \"Identity\",\n  \"order\": 0,\n  \"paths\": [\n    \"/identity/name\",\n    \"/identity/city\"\n  ],\n  \"revision\": 1,\n  \"updatedAt\": \"2026-09-05T00:00:00Z\"\n}\n","stderr":"","uuidCalls":1,"nonceCalls":0,"expectedWrites":["fact-groups.json"],"observedWrites":["fact-groups.json"],"effects":[{"path":"fact-groups.json","before":"{\n  \"groups\": {},\n  \"metadata\": {\n    \"createdAt\": \"2026-09-05T00:00:00Z\",\n    \"updatedAt\": \"2026-09-05T00:00:00Z\"\n  },\n  \"schemaVersion\": 1\n}\n","after":"{\n  \"groups\": {\n    \"00000000000000000000000000000001\": {\n      \"createdAt\": \"2026-09-05T00:00:00Z\",\n      \"id\": \"00000000000000000000000000000001\",\n      \"label\": \"Identity\",\n      \"order\": 0,\n      \"paths\": [\n        \"/identity/name\",\n        \"/identity/city\"\n      ],\n      \"revision\": 1,\n      \"updatedAt\": \"2026-09-05T00:00:00Z\"\n    }\n  },\n  \"metadata\": {\n    \"createdAt\": \"2026-09-05T00:00:00Z\",\n    \"updatedAt\": \"2026-09-05T00:00:00Z\"\n  },\n  \"schemaVersion\": 1\n}\n","mtimeChanged":true,"modeContract":"0600-on-posix-unverified-on-windows"}],"untouchedEntriesUnchanged":true,"rejectedStateUnchanged":false},